Código IES,Nome da IES - Instituição de Ensino Superior
1525,FACULDADE DE CIENCIAS CONTABEIS DE AFONSO CLAU
1526,FACULDADE DE TECNOLOGIA SENAI ANTOINE SKAF
1527,FACULDADE TAMOIOS
1528,FACULDADE DE CIENCIAS HUMANAS SAO PAULO
1529,FACULDADE DE EDUCACAO FISICA DE AMERICANA
1530,FACULDADE CNEC JOINVILLE
1531,FACULDADE DE ENFERMAGEM DO PLANALTO CENTRAL
1532,FACULDADE DE SERTAOZINHO
1533,FACULDADE DE COMUNICACAO SOCIAL
1534,FACULDADE DE CIENCIAS LETRAS E EDUCACAO DO NOR
1535,FACULDADE DE PINHAIS
1536,FACULDADE DE TELEMACO BORBA
1537,FACULDADE EXPONENCIAL
1538,CENTRO UNIVERSITARIO PROJECAO
1539,FACULDADE ITALO BRASILEIRA
1540,INSTITUTO DE ENSINO SUPERIOR DE RONDONIA
1541,FACULDADE FLAMINGO
1542,CENTRO UNIVERSITARIO GERALDO DI BIASE
1543,FACULDADE DE DIREITO DE LINHARES
1544,FACULDADE DECISAO
1545,FACULDADE DE BOITUVA
1546,FACULDADE DE EDUCACAO SAO FRANCISCO
1547,FACULDADE DE MEDICINA ESTACIO DE JUAZEIRO DO N
1548,FACULDADE DE CAMPO GRANDE
1549,FACULDADE PALAS ATENA DE CHOPINZINHO
1550,FACULDADE DE EDUCACAO FISICA DE FOZ DO IGUACU
1551,FACULDADE FRANCO BRASILEIRO
1552,FACULDADE UNINASSAU PARNAIBA
1553,FACULDADE DE ODONTOLOGIA DE SAO JOSE DO RIO PR
1554,CENTRO UNIVERSITARIO DO VALE DO RIBEIRA
1555,FACULDADE DE DIREITO DE GUARAPUAVA
1556,CENTRO UNIVERSITARIO SETE DE SETEMBRO
1557,UNIVERSIDADE FUMEC
1558,FACULDADE DOCTUM DE JOAO MONLEVADE
1559,CENTRO UNIVERSITARIO DO ESPIRITO SANTO
1561,FACULDADE ESAMC SOROCABA
1562,FACULDADE DE ILHA SOLTEIRA
1563,CENTRO UNIVERSITARIO UNINOVAFAPI
1564,FACULDADE SUL FLUMINENSE
1565,FACULDADE UNIME DE CIENCIAS JURIDICAS
1567,FACULDADE VIZINHANCA VALE DO IGUACU
1568,FACULDADES DOCTUM DE CARATINGA
1569,FACULDADES INTEGRADAS DE ARARAQUARA
1570,FACULDADE DE CIENCIAS CONTABEIS DE POMBAL
1571,FACULDADE UNIME DE CIENCIAS SOCIAIS
1572,FACULDADE DE CIENCIAS SOCIAIS APLICADAS
1573,FACULDADE ALFREDO NASSER
1574,FACULDADE EDUCACIONAL DE MEDIANEIRA
1575,CENTRO UNIVERSITARIO DO PLANALTO DE ARAXA
1576,INSTITUTO DE ENSINO SUPERIOR BLAURO CARDOSO DE
1577,FACULDADE INTERMUNICIPAL DO NOROESTE DO PARANA
1578,INSTITUTO FEDERAL DE EDUCACAO  CIENCIA E TECNO
1579,FACULDADE DE CIENCIAS SOCIAIS DE IBIRACU
1580,FACULDADE DE CIENCIAS E EDUCACAO SENA AIRES
1581,FACULDADE DE SANTA LUZIA
1582,FACULDADE DECISAO
1583,FACULDADE DE TECNOLOGIA DE INDAIATUBA
1584,FACULDADE DE TECNOLOGIA DE GUARATINGUETA
1585,FACULDADE ENERGIA
1586,UNIVERSIDADE DO VALE DO SAPUCAI
1587,FACULDADES INTEGRADAS DE TANGARA DA SERRA
1588,FACULDADE PITAGORAS DE TURISMO E HOTELARIA DE
1590,CENTRO UNIVERSITARIO ESTACIO DE SAO LUIS
1591,FACULDADE ESTACIO MACAPA  ESTACIO MACAPA
1592,FACULDADE DE ODONTOLOGIA DE MANAUS
1593,FACULDADE DE PEDAGOGIA DE EUNAPOLIS
1594,FACULDADE DE LETRAS DA INSTITUICAO DE ENSINO S
1595,FACULDADE DE LETRAS UNIAO DE ENSINO SUPERIOR C
1596,FACULDADE DE CIENCIAS E EDUCACAO DO ESPIRITO S
1597,FACULDADE SANTA FE
1598,CENTRO UNIVERSITARIO UNA DE UBERLANDIA
1599,CENTRO UNIVERSITARIO PRESIDENTE TANCREDO DE AL
1600,INSTITUTO DE CIENCIAS DA SAUDE
1601,FACULDADE CIDADE DE COROMANDEL
1602,FACULDADE DE CIENCIAS GERENCIAIS DO OESTE DE M
1603,FACULDADE DE COMUNICACAO SOCIAL DO OESTE DE MI
1604,FACULDADE MAGNUN DE EDUCACAO FISICA E ESPORTE
1605,FACULDADE DE ADMINISTRACAO DE NOVA ANDRADINA
1606,FACULDADES INTEGRADAS DE CASSILANDIA
1607,FACULDADE LUTERANA SAO MARCOS
1608,FACULDADE DE INFORMATICA DE PATOS
1609,FACULDADE DOS CERRADOS PIAUIENSES
1610,FACULDADE DAS ATIVIDADES EMPRESARIAIS DE TERES
1611,FACULDADE EDUCACIONAL DE ARAPOTI
1612,FACULDADE ASSIS GURGACZ
1613,FACULDADE ADVENTISTA PARANAENSE
1614,FACULDADE ASTORGA
1615,INSTITUTO SUPERIOR DO LITORAL DO PARANA
1616,FACULDADE ANGEL VIANNA
1617,FACULDADE DE CIENCIAS ECONOMICAS DA REGIAO CAR
1618,CENTRO UNIVERSITARIO SOCIESC DE BLUMENAU
1619,FACULDADE DE OLIMPIA
1620,FACULDADE SANTA RITA
1621,FACULDADE NETWORK
1622,FACULDADE DO INTERIOR PAULISTA
1623,FACULDADE DE CIENCIAS AGRARIAS DE ANDRADINA
1624,FACULDADE MARECHAL RONDON
1625,FACULDADE REUNIDA
1626,CENTRO DE TECNOLOGIA E CIENCIA CETEC
1627,FACULDADE DE EDUCACAO DE MONTE ALTO
1628,FACULDADE DE CIENCIAS HUMANAS DE AGUAI
1629,INSTITUTO DE ENSINO SUPERIOR AQUIDAUANENSE
1630,FACULDADE ITABIRANA DE DESENVOLVIMENTO DAS CIE
1631,FACULDADE PITAGORAS DE FISIOTERAPIA DE MONTES
1632,FACULDADE PITAGORAS DE LONDRINA
1633,CENTRO FEDERAL DE EDUCACAO TECNOLOGICA DE CUIA
1634,FACULDADE DOCTUM DA SERRA
1636,CASTELLI ESCOLA SUPERIOR DE HOTELARIA
1637,FACULDADE DE CIENCIAS JURIDICAS E SOCIAIS DE M
1638,FACULDADE DO AMAZONAS
1639,FACULDADE HELIO ROCHA
1640,CENTRO UNIVERSITARIO AGES
1641,CENTRO UNIVERSITARIO SOCIAL DA BAHIA
1642,FACULDADE DE TECNOLOGIA E CIENCIAS DE ITABUNA
1643,FACULDADE ANISIO TEIXEIRA DE FEIRA DE SANTANA
1644,FACULDADE UNIME DE EDUCACAO E COMUNICACAO
1645,FACULDADE DE TECNOLOGIA E CIENCIAS DE JEQUIE
1646,FACULDADE DE EDUCACAO CIENCIAS E LETRAS DE PAR
1647,FACULDADE DE ENSINO E CULTURA DO CEARA
1648,FACULDADE COMPACTO DE COMUNICACAO SOCIAL
1649,FACULDADE DE COMUNICACAO DA SERRA
1650,FACULDADE J  SIMOES ENSINO SUPERIOR
1651,FACULDADE DE EDUCACAO
1652,FACULDADE DE VITORIA
1653,FACULDADE DE CIENCIA E EDUCACAO DO CAPARAO
1654,INSTITUTO DE ENSINO SUPERIOR DE NOVA VENECIA
1655,FACULDADE CENECISTA DE SETE LAGOAS
1656,INSTITUTO DE ENSINO SUPERIOR DE TERESINA
1657,CENTRO UNIVERSITARIO UNISEP
1658,CENTRO UNIVERSITARIO DA GRANDE FORTALEZA
1659,FACULDADE ESTACIO DE SA DE OURINHOS
1660,CENTRO UNIVERSITARIO ESTACIO DE BRASILIA  ESTA
1661,FACULDADE PROJECAO DE SOBRADINHO
1662,FACULDADE COMUNITARIA DE ADMINISTRACAO E EDUCA
1663,FACULDADE ARAGUAIA
1664,FACULDADE DA SAUDE E ECOLOGIA HUMANA
1665,FACULDADE KENNEDY
1666,CENTRO UNIVERSITARIO UNIHORIZONTES
1667,FACULDADE INTERNACIONAL DE CIENCIAS EMPRESARIA
1668,FACULDADE PITAGORAS DE MINAS GERAIS
1669,INSTITUTO METROPOLITANO DE ENSINO SUPERIOR
1670,FACULDADE ASA DE BRUMADINHO
1671,FACULDADE DE ENSINO UNIFICADO DE BELO HORIZONT
1672,INSTITUTO ESPERANCA DE ENSINO SUPERIOR
1673,FACULDADE DE AGRONOMIA DE POMBAL
1674,INSTITUTO SALESIANO DE FILOSOFIA
1675,FACULDADE METROPOLITANA DA GRANDE RECIFE
1676,CENTRO UNIVERSITARIO SAO MIGUEL
1677,FACULDADE DE ENSINO SUPERIOR DO PIAUI
1678,FACULDADE DE CIENCIAS DE WENCESLAU BRAZ
1679,FACULDADE DE CAMPINA GRANDE DO SUL
1680,FACULDADE UNIRB  MOSSORO
1681,FACULDADE DE CIENCIAS SOCIAIS APLICADAS IBMEC
1682,FACULDADE SALESIANA MARIA AUXILIADORA
1683,CENTRO UNIVERSITARIO MAURICIO DE NASSAU DE TER
1684,FACULDADE DE RORAIMA
1685,FACULDADE BARDDAL DE CIENCIAS CONTABEIS
1686,FACULDADE BARDDAL DE ARTES APLICADAS
1687,FACULDADE IDEPE
1688,FACULDADE SENAC DE EDUCACAO EM SAUDE
1689,FACULDADE SANTA IZILDINHA
1690,FACULDADE DE SAO VICENTE
1691,FACULDADE PRAXIS
1692,ESCOLA SUPERIOR DE TECNOLOGIA E EDUCACAO DE PO
1693,FACULDADE ITANHAEM
1694,ESCOLA SUPERIOR DE CRICIUMA  ESUCRI
1695,FACULDADE DE EDUCACAO DE BOM DESPACHO
1696,FACULDADE CENTRAL DE CRISTALINA
1697,CENTRO UNIVERSITARIO FACOL
1698,FACULDADE DE CIENCIAS SOCIAIS APLICADAS DO CES
1699,FACULDADE DE EDUCACAO DE JARU
1700,FACULDADE PROMOVE DE SETE LAGOAS
1701,FACULDADE MACHADO DE ASSIS
1702,CENTRO UNIVERSITARIO ESTACIO DA AMAZONIA
1703,INSTITUTO DE ENSINO SUPERIOR DE RIO VERDE
1704,FACULDADE DE ADMINISTRACAO DO ALTO VALE DO RIO
1705,FACULDADE DE EDUCACAO DO ALTO VALE DO RIO TUBA
1706,FACULDADE DE INFORMATICA DO RECIFE
1707,FACULDADE DE CIENCIAS CONTABEIS DE RECIFE
1708,INSTITUTO PERNAMBUCANO DE ENSINO SUPERIOR
1709,CENTRO UNIVERSITARIO TIRADENTES DE PERNAMBUCO
1710,FACULDADE ANHANGUERA DE NEGOCIOS E TECNOLOGIAS
1711,FACULDADE DE PRESIDENTE PRUDENTE
1712,FACULDADE DE CIENCIAS E TECNOLOGIA DE TERESINA
1713,FACULDADE DE TECNOLOGIA DE SAO VICENTE
1714,ESCOLA SUPERIOR DE GESTAO COMERCIAL E MARKETIN
1716,CENTRO UNIVERSITARIO UNIAO DAS AMERICAS
1717,FACULDADE DE IMPERATRIZ WYDEN
1718,FACULDADE NOBRE DE FEIRA DE SANTANA
1719,FACULDADE DE ADMINISTRACAO DE CAMPOS GERAIS
1720,FACULDADE MINAS GERAIS
1721,FACULDADE DE VICOSA
1722,FACULDADE DE PORTO VELHO
1723,ESCOLA SUPERIOR DE ADMINISTRACAO E GESTAO STRO
1724,FACULDADE DE GUARARAPES
1725,FACULDADE XV DE AGOSTO
1726,CENTRO UNIVERSITARIO SANTA AMELIA
1727,FACULDADE DE CARIACICA
1728,FACULDADE INTERAMERICANA DE PORTO VELHO
1729,FACULDADE DE ODONTOLOGIA DOS CAMPOS GERAIS
1730,FACULDADE NORTE CAPIXABA
1731,FACULDADE DE CIENCIAS SOCIAIS APLICADAS
1732,FACULDADE GENNARI E PEARTREE
1733,FACULDADE DE ENSINO SUPERIOR DE MARECHAL CANDI
1734,FACULDADE INTEGRAL DIFERENCIAL WYDEN
1735,CENTRO UNIVERSITARIO DOUTOR LEAO SAMPAIO
1736,CENTRO UNIVERSITARIO LA SALLE DO RIO DE JANEIR
1737,FACULDADE DE INFORMATICA DE TAQUARA
1738,FACULDADE SAO LUCAS PORTO VELHO
1739,FACULDADE FORTIUM SAO SEBASTIAO
1740,FACULDADE DE TECNOLOGIA RADIAL
1741,FACULDADE DE TECNOLOGIA INTERAMERICA
1742,FACULDADE DE TECNOLOGIA CARLOS DRUMMOND DE AND
1743,FACULDADE DE TECNOLOGIA OSWALDO CRUZ
1744,FACULDADE DE TECNOLOGIA OPET
1745,FACULDADE INTERATIVA DE SAO PAULO
1746,FACULDADE DE TECNOLOGIA DAS AMERICAS
1747,FACULDADE DE TECNOLOGIA FLAMINGO
1748,FACULDADE DE TECNOLOGIA MARIO DE ANDRADE
1749,FACULDADE LUSOBRASILEIRA
1750,UNIDADE DE ENSINO SUPERIOR EXPOENTE
1751,FACULDADE DE DESIGN GRAFICO
1752,FACULDADE AUTONOMA DE DIREITO
1753,FACULDADE DE ENFERMAGEM NOVA ESPERANCA
1754,INSTITUTO SUPERIOR DE EDUCACAO DE BRASILIA
1755,FACULDADE EQUIPE
1756,FACULDADE ASSOCIADA BRASIL
1757,ESCOLA SUPERIOR DE ADMINISTRACAO MARKETING E C
1758,FACULDADE INDEPENDENTE DO NORDESTE
1759,FACULDADE PADRE JOAO BAGOZZI
1760,FACULDADE DE PEDAGOGIA DE VITORIA DE SANTO ANT
1761,FACULDADE BRASILEIRA DE GESTAO E NEGOCIOS
1762,FACULDADE DE TECNOLOGIA E NEGOCIOS CARLOS DRUM
1763,FACULDADE DE TECNOLOGIA SENAI CHAPECO
1764,FACULDADE DE EDUCACAO REGIONAL SERRANA
1765,FACULDADE DE JOSE BONIFACIO
1766,FACULDADE ESPIRITO SANTENSE
1767,FACULDADE DE CIENCIAS SOCIAIS APLICADAS
1768,FACULDADE REGIONAL SERRANA
1769,FACULDADE DE TURISMO DE CARATINGA
1770,FACULDADE DE CIENCIAS EXATAS E TECNOLOGICAS DA
1771,FACULDADE DE TECNOLOGIA E CIENCIAS
1772,CENTRO UNIVERSITARIO FANOR WYDEN
1773,CENTRO UNIVERSITARIO FAI
1774,FACULDADE EDUCACIONAL DE PONTA GROSSA
1775,CENTRO UNIVERSITARIO FAVIP WYDEN
1776,FACULDADE ANHANGUERA DE TECNOLOGIA DE JUNDIAI
1777,CENTRO UNIVERSITARIO LEONARDO DA VINCI
1778,FACULDADE DE EDUCACAO CIENCIAS E LETRAS SAO JU
1779,FACULDADE AIEC
1780,FACULDADE HORIZONTINA
1781,FACULDADE INTESP
1782,FACULDADE DE ARTES CIENCIAS E TECNOLOGIAS
1783,FACULDADE DE CIENCIAS SOCIAIS APLICADAS
1784,FACULDADE ANHANGUERA DE SAO CAETANO
1785,FACULDADE DE COLIDER
1786,INSTITUTO MACHADENSE DE ENSINO SUPERIOR
1787,INSTITUTO DE ENSINO SUPERIOR DE JOINVILLE
1788,FACULDADE DE ADMINISTRACAO E ARTES DE LIMEIRA
1789,FACULDADE CATUAI
1790,FACULDADE DO SUL DA BAHIA
1791,FACULDADE DE CIENCIAS EXATAS E TECNOLOGICAS DA
1792,FACULDADE DE EDUCACAO DE VITORIA
1793,FACULDADE DE CIENCIAS EXATAS E TECNOLOGICAS DE
1794,FACULDADE DE CIENCIAS HUMANAS DE UNIAO DA VITO
1795,FACULDADE DE CIENCIAS SOCIAIS APLICADAS DE UNI
1796,FACULDADE DE MATEMATICA DA INSTITUICAO DE ENSI
1797,FACULDADES LONDRINA
1798,FACULDADE EDUCACIONAL DE CORNELIO PROCOPIO
1799,FACULDADE BRASILIA DE TECNOLOGIA CIENCIAS E ED
1800,FACULDADE REGES DE REALEZA
1801,FACULDADE DOM BOSCO DE UBIRATA
1803,FACULDADE DE TECNOLOGIA E CIENCIAS DE PERNAMBU
1804,FACULDADE DE MAUA  FAMA
1805,CENTRO UNIVERSITARIO DOS GUARARAPES
1806,FACULDADE FERNAO DIAS
1807,INSTITUTO FEDERAL DE EDUCACAO  CIENCIA E TECNO
1808,INSTITUTO FEDERAL DE EDUCACAO  CIENCIA E TECNO
1809,INSTITUTO FEDERAL DE EDUCACAO  CIENCIA E TECNO
1810,INSTITUTO FEDERAL DE EDUCACAO  CIENCIA E TECNO
1811,INSTITUTO FEDERAL DE EDUCACAO  CIENCIA E TECNO
1812,INSTITUTO FEDERAL DE EDUCACAO  CIENCIA E TECNO
1813,INSTITUTO FEDERAL DE EDUCACAO  CIENCIA E TECNO
1814,FACULDADE DE CIENCIAS SOCIAIS E APLICADAS DE D
1815,FACULDADE DO INSTITUTO BRASIL
1816,INSTITUTO DE ENSINO SUPERIOR DE BAURU
1817,FACULDADE ESTACIO DE CURITIBA
1818,FACULDADE PITAGORAS DE BELO HORIZONTE
1819,CENTRO UNIVERSITARIO FARIAS BRITO
1820,INSTITUTO FEDERAL DE EDUCACAO  CIENCIA E TECNO
1821,FACULDADE LIONS
1822,FACULDADE SULAMERICANA
1823,INSTITUTO DE ENSINO SUPERIOR DO AMAPA
1824,FACULDADE DE CIENCIAS CONTABEIS DE ITABIRITO
1825,FACULDADE DE ESTUDOS SUPERIORES DE MINAS GERAI
1826,FACULDADE DE DIREITO DE LEOPOLDINA
1827,FACULDADE LUTERANA DE TEOLOGIA
1828,ESCOLA DA CIDADE  FACULDADE DE ARQUITETURA E U
1829,FACULDADE DE TECNOLOGIA UIRAPURU
1830,FACULDADE ANHANGUERA DE PASSO FUNDO
1831,FACULDADE DE IBITINGA
1832,FACULDADE DE JABOTICABAL
1833,FACULDADE DE ARUJA
1834,FACULDADE DE AGUDOS
1835,FACULDADE DE COLINAS DO TOCANTINS
1836,CENTRO UNIVERSITARIO FUNDACAO DE ENSINO OCTAVI
1837,ESCOLA DE ESTUDOS SUPERIORES DE VICOSA
1838,FACULDADES INTEGRADAS RIO BRANCO
1839,FACULDADES INTEGRADAS DE VARZEA GRANDE
1840,FACULDADE CASTELO BRANCO
1841,CENTRO UNIVERSITARIO ANTONIO EUFRASIO DE TOLED
1842,FACULDADES INTEGRADAS MACHADO DE ASSIS
1843,FACULDADE DE ADMINISTRACAO DE CAMPO BELO
1844,FACULDADES INTEGRADAS STELLA MARIS DE ANDRADIN
1845,FEFISA  FACULDADES INTEGRADAS DE SANTO ANDRE
1846,CENTRO UNIVERSITARIO DE LINS
1847,FACULDADE PITAGORAS DE IMPERATRIZ
1848,FACULDADE CENECISTA DE SANTA TEREZINHA DE ITAI
1849,FACULDADE DE DIREITO DE MOGI MIRIM
1850,FACULDADE SANTA MARIA DA GLORIA
1851,ESCOLA BRASILEIRA DE ADMINISTRACAO PUBLICA E D
1852,FACULDADE SABERES
1853,CENTRO UNIVERSITARIO UNIBTA
1854,CLARETIANO  CENTRO UNIVERSITARIO
1855,CENTRO UNIVERSITARIO CATOLICO DO SUDOESTE DO P
1856,FACULDADE DO NORTE NOVO DE APUCARANA
1857,FACULDADE DEHONIANA
1858,FACULDADE DOM PEDRO II DE JEQUIE
1859,INSTITUTO SUPERIOR DE EDUCACAO UIRAPURU
1860,FACULDADE DE CIENCIAS GERENCIAIS PADRE ARNALDO
1861,FACULDADE DE DIREITO DE CACOAL
1862,FACULDADE DA REGIAO SERRANA
1863,FACULDADE MANTENENSE DOS VALES GERAIS (INTERVA
1864,FACULDADE DE ADMINISTRACAO DA ASSOCIACAO BRASI
1865,FACULDADE ALVORADA PAULISTA
1866,FACULDADE DE CIENCIAS EDUCACIONAIS E EMPRESARI
1867,FACULDADE SANTOS DUMONT
1868,INSTITUTO SUPERIOR DE EDUCACAO DE SANTOS DUMON
1869,CENTRO UNIVERSITARIO DE ITAJUBA
1870,FACULDADES INTEGRADAS REGIONAIS DE AVARE
1871,FACULDADE DE MEDICINA DE CARATINGA
1872,FACULDADES INTEGRADAS SANTA CRUZ DE CURITIBA
1873,FACULDADE MERCURIO
1874,FACULDADE DE TECNOLOGIA DE OURINHOS
1875,FACULDADE DE FILOSOFIA  CIENCIAS E LETRAS DE I
1876,FACULDADE MUNICIPAL PROFESSOR FRANCO MONTORO D
1877,FACULDADE ATUAL
1878,CENTRO UNIVERSITARIO DA FUNDACAO EDUCACIONAL I
1879,CENTRO UNIVERSITARIO UNIFACEAR
1880,FACULDADE CASA DO ESTUDANTE
1881,FACULDADE DA ESCADA
1882,FACULDADE DE ASSUNTOS ACADEMICOS E CIENTIFICOS
1883,CENTRO UNIVERSITARIO UNIFAS
1884,FACULDADE DE RANCHARIA
1885,CENTRO UNIVERSITARIO UNIDADE DE ENSINO SUPERIO
1886,FACULDADE DE MONTE ALTO
1887,FACULDADE DE DIREITO DA SERRA
1888,FACULDADE DE SAUDE TECSOMA
1889,FACULDADE HOYLER DE LETRAS
1890,FACULDADE INTEGRADA DE GOIAS
1891,FACULDADE SARTRE COC
1892,CENTRO UNIVERSITARIO DE EXCELENCIA ENIAC
1893,FACULDADE UNIRB  FEIRA DE SANTANA
1894,FACULDADE EUROPEIA DE ADMINISTRACAO E MARKETIN
1895,CENTRO UNIVERSITARIO CHRISTUS
1896,FACULDADE DE TURISMO DE NOVA ANDRADINA
1897,FACULDADE DE LETRAS DE NOVA ANDRADINA
1898,FACULDADE DO LITORAL SUL PAULISTA
1899,FACULDADE DE NOVA ESPERANCA
1900,CENTRO UNIVERSITARIO DO PARANA
1901,FACULDADE CATOLICA DE UBERLANDIA
1902,FACULDADE SANTO AGOSTINHO
1903,FACULDADE CRISTO REI
1904,FACULDADE SAO CAMILO
1905,FACULDADE SANTA ADAME
1906,INSTITUTO DE ENSINO SUPERIOR MATERDEI
1907,FACULDADE EDUCACIONAL DE COLOMBO
1908,ESCOLA DE ENSINO SUPERIOR FABRA
1909,FACULDADES DOCTUM DE IPATINGA
1910,FACULDADE UNINASSAU LAURO DE FREITAS
1911,FACULDADE CENTROOESTE
1912,INSTITUTO SUPERIOR DE EDUCACAO JAPI
1913,CENTRO UNIVERSITARIO FAMINAS
1914,FACULDADE PITAGORAS DE ENFERMAGEM DE MONTES CL
1915,FACULDADE DE EDUCACAO SILVA SERPA
1916,INSTITUTO SUPERIOR DE EDUCACAO PITAGORAS
1917,FACULDADE DE CIENCIAS BIOMEDICAS DE CACOAL
1918,FACULDADE CAPIVARI
1919,FACULDADE DE CIENCIAS EXATAS E TECNOLOGICAS SA
1920,FACULDADE DE FARMACIA DO PLANALTO CENTRAL
1921,FACULDADE DE SAO BENTO
1922,ESCOLA SUPERIOR DE FISIOTERAPIA ESUFI
1923,FACULDADE DE DIREITO PADRE ARNALDO JANSSEN
1924,FACULDADE DO NORTE PIONEIRO DE JACAREZINHO
1925,FACULDADE DE CIENCIAS SOCIAIS APLICADAS SANTO
1926,FACULDADE DE ADMINISTRACAO DE CATAGUASES
1927,CENTRO UNIVERSITARIO DO VALE DO IGUACU
1928,FACULDADE CNEC ILHA DO GOVERNADOR
1929,FACULDADE DE CIENCIAS CONTABEIS FACICONT
1930,INSTITUTO SUPERIOR DE EDUCACAO DE SAO PAULO
1931,INSTITUTO DE ENSINO SUPERIOR FRANCISCANO
1932,FACULDADE PALOTINA
1933,FACULDADE BIRIGUI
1934,FACULDADE SINOP
1935,FACULDADE SAO PAULO DE SANTOS
1936,FACULDADE LA SALLE
1937,FACULDADE EVANGELICA DE SALVADOR
1938,FACULDADE DE UMUARAMA
1939,INSTITUTO DE ENSINO SUPERIOR DE LONDRINA  INES
1940,FACULDADE DE NOVA SERRANA
1941,FACULDADE CUIABA
1942,FACULDADE DE COMUNICACAO SOCIAL DE FLORIANOPOL
1943,FACULDADE JK SOBRADINHO
1944,FACULDADE DE TECNOLOGIA IBRATEC
1945,FACULDADE DE SORRISO
1946,FACULDADE LEGALE
1947,FACULDADE DE ENGENHARIA DE TAQUARA
1948,FACULDADE DE ENSINO SUPERIOR DA PARAIBA
1949,CENTRO UNIVERSITARIO DE PAULINIA
1950,FACULDADE DE ORLANDIA
1951,INSTITUTO DE EDUCACAO E ENSINO SUPERIOR DE SAM
1952,CENTRO UNIVERSITARIO CATHEDRAL
1953,FACULDADE DE CIENCIAS BIOLOGICAS E DA SAUDE
1954,FACULDADE DE ECONOMIA
1955,FACULDADE DE CIENCIAS HUMANAS DE LAGES
1956,FACULDADE REGIONAL BRASILEIRA  MACEIO
1957,FACULDADE DE TECNOLOGIA SENAI JOINVILLE
1958,FACULDADE DE TECNOLOGIA SENAI BLUMENAU
1959,FACULDADE DE CIENCIAS JURIDICAS DO PLANALTO CE
1960,FACULDADE DE MEDICINA DO PLANALTO CENTRAL
1961,INSTITUTO TECNOLOGICO E DAS CIENCIAS SOCIAIS A
1962,INSTITUTO SUPERIOR DE EDUCACAO DO CENTRO EDUCA
1963,FACULDADE DE FISIOTERAPIA DOS CAMPOS GERAIS
1964,FACULDADE DE TECNOLOGIA EM HOTELARIA  GASTRONO
1965,FACULDADE DE TECNOLOGIA DE ALAGOAS
1966,FACULDADE ALBERT EINSTEIN
1967,FACULDADE DO VALE DO ITAPECURU
1968,FACULDADE BRASILEIRA DE TECNOLOGIA
1969,FACULDADE DOS IMIGRANTES FAI
1970,FACULDADE DO ESPIRITO SANTO
1971,FACULDADE DE TECNOLOGIA MORUMBI SUL
1972,FACULDADE DE SAO CAETANO DO SUL
1973,INSTITUTO SUPERIOR DE EDUCACAO ORIGENES LESSA
1974,INSTITUTO SUPERIOR DE EDUCACAO DE CAXIAS
1975,FACULDADE DE CIENCIAS AGRARIAS DOS CAMPOS GERA
1976,INSTITUTO SUPERIOR DE EDUCACAO DE LINHARES
1977,CENTRO DE ESTUDOS SUPERIORES APRENDIZ
1978,CENTRO UNIVERSITARIO FAMETRO
1979,INSTITUTO SUPERIOR DE EDUCACAO CENECISTA DE BR
1980,FACULDADE SINERGIA
1981,FACULDADE MILLENNIUM
1982,FACULDADE DE COMUNICACAO SOCIAL DE PATOS
1983,FACULDADE DE CIENCIAS E DA SAUDE DE PATOS
1984,CENTRO UNIVERSITARIO UNIFACIG
1985,FACULDADE COMUNITARIA DE CAMPINAS
1986,CENTRO UNIVERSITARIO ESTACIO JUIZ DE FORA  EST
1987,FACULDADE DE FILOSOFIA CIENCIAS E LETRAS DEPUT
1988,CENTRO UNIVERSITARIO AVANTIS
1989,INSTITUTO SUPERIOR DE EDUCACAO AVANTIS
1990,FACULDADE DE CIENCIAS SOCIAIS APLICADAS DE FOR
1991,FACULDADE JOAO PAULO PRIMEIRO
1992,INSTITUTO DE ENSINO SUPERIOR DE PIEDADE
1993,FACULDADE IDEAL DE PATOS
1994,INSTITUTO DE ENSINO SUPERIOR DE DOURADOS
1995,FACULDADE DE MEDICINA NOVA ESPERANCA
1996,INSTITUTO CUIABA DE ENSINO E CULTURA
1997,INSTITUTO DE ENSINO SUPERIOR DE ARIPUANA
1998,INSTITUTO SUPERIOR DE EDUCACAO ELVIRA DAYRELL
1999,JOHN KNOX
2000,FACULDADE TATUAPE
2001,SEMINARIO ADVENTISTA LATINOAMERICANO DE TEOLOG
2002,INSTITUTO SUPERIOR DE EDUCACAO DIVINO SALVADOR
2003,FACULADE TEOLOGICA SINAL
2004,FACULDADE DE DIREITO PRESIDENTE CASTELO BRANCO
2005,FACULDADE DE CIENCIAS SOCIAIS APLICADAS DE SIN
2006,INSTITUTO SUPERIOR DE EDUCACAO DE VITORIA
2007,FACULDADE DE CIENCIAS EXATAS E TECNOLOGICAS DO
2008,INSTITUTO SUPERIOR DE EDUCACAO DE SAO GOTARDO
2009,FACULDADE DE TAQUARITINGA
2011,INSTITUTO NACIONAL DE EDUCACAO DE PORTO SEGURO
2012,INSTITUTO SUPERIOR DE EDUCACAO DE PESQUEIRA
2013,INSTITUTO SUPERIOR DE EDUCACAO
2014,FACULDADE SETELAGOANA DE CIENCIAS GERENCIAIS
2015,INSTITUTO SANTO TOMAS DE AQUINO
2016,LOGOS FACULDADE
2017,FACULDADES DE ALTA FLORESTA
2018,FACULDADE EVOLUCAO
2019,INSTITUTO SUPERIOR DE EDUCACAO DE SALGUEIRO
2020,INSTITUTO DE EDUCACAO SUPERIOR EUROBRAS
2021,FACULDADE JK  UNIDADE II  GAMA
2022,FACULDADE DE ROLIM DE MOURA
2023,CENTRO UNIVERSITARIO FG
2024,INSTITUTO SUPERIOR DE EDUCACAO DAS CLARETIANAS
2025,INSTITUTO SUPERIOR DE EDUCACAO CARLI GIOVANNI
2026,INSTITUTO SUPERIOR DE EDUCACAO BRASIL
2027,FACULDADE DE CAMPINA GRANDE
2028,FALCUDADE DE CIENCIAS ECONOMICAS CONTABEIS E A
2029,INSTITUTO SUPERIOR DE EDUCACAO DE MARECHAL CAN
2030,INSTITUTO SUPERIOR DE EDUCACAO CAMPO LIMPO PAU
2031,FACULDADE DE EDUCACAO DE PRESIDENTE MEDICI
2032,FACULDADE DE PEDAGOGIA E FORMACAO DE NORMALIST
2033,INSTITUTO SUPERIOR DE EDUCACAO DE FLORESTA
2034,FACULDADE DE CIENCIAS CONTABEIS DE ARAGUAINA
2035,UNIAO LATINOAMERICANA DE TECNOLOGIA
2036,FACULDADE ESTACIO DO PARA  ESTACIO FAP
2037,FACULDADE UNIME DE CIENCIAS EXATAS E TECNOLOGI
2038,INSTITUTO DE EDUCACAO SUPERIOR VALE DO MEARIM
2039,FACULDADE CIDADE LUZ
2040,FACULDADE DO FUTURO
2041,FACULDADE SUDAMERICA
2042,FACULDADE FIGUEIREDO COSTA  FIC
2043,CENTRO UNIVERSITARIO VALE DO SALGADO
2044,INSTITUTO SUPERIOR DE EDUCACAO VALE DO SALGADO
2045,FACULDADE AMADEUS
2046,INSTITUTO SUPERIOR DE EDUCACAO AMADEUS
2047,FACULDADE DE PSICOLOGIA DE CACOAL
2048,FACULDADE DE CIENCIAS E TECNOLOGIA DE CACOAL
2049,INSTITUTO DE ESTUDOS SUPERIORES DO MARANHAO
2050,ESCOLA SUPERIOR DE GESTAO E CIENCIAS DA SAUDE
2051,FACULDADE INTERFUTURA
2052,FACULDADE DE DIREITO DE LAGES
2053,FACULDADE PARA O DESENVOLVIMENTO DE PERNAMBUCO
2054,FACULDADE DE EDUCACAO DE NOVA ANDRADINA
2055,FACULDADE ARAUCARIA DO SUDOESTE DO PARANA
2056,FACULDADE DA ALTA PAULISTA
2057,FACULDADE DE MOGI GUACU
2058,FACULDADE METROPOLITANA
2059,FACULDADE DE EDUCACAO E CIENCIAS DE TAGUATINGA
2060,FACULDADE PADRE SEVERIANO LTDA
2062,INSTITUTO SUPERIOR DE EDUCACAO CENECISTA DE VA
2063,INSTITUTO NOSSA SENHORA APARECIDA DE EDUCACAO
2064,FACULDADE METROPOLITANA DE SALVADOR
2065,FACULDADE DE FILOSOFIA E TEOLOGIA DE ALAGOAS
2066,FACULDADE LEONARDO DA VINCI
2067,FACULDADE DE CIENCIAS E EMPREENDEDORISMO
2068,FACULDADE DE CASTILHO
2069,FACULDADE DE TEOLOGIA E CIENCIAS HUMANAS
2070,FACULDADE DE CIENCIAS SOCIAIS AMORIL
2071,FACULDADE TEOLOGICA BATISTA DO BRASIL
2072,FACULDADE DE DESENVOLVIMENTO SUSTENTAVEL DE CR
2073,INSTITUTO SUPERIOR DE EDUCACAO PADRAO
2074,INSTITUTO EDUCACIONAL SAO JOAO DA ESOCIA DE EN
2075,INSTITUTO DE ENSINO SUPERIOR DE ALAGOAS
2076,CENTRO UNIVERSITARIO UNIRB
2077,FACULDADE ANGLOAMERICANO
2078,FACULDADE DE CIENCIAS HUMANAS E SOCIAIS DE JOI
2079,FACULDADE DE ITAITUBA
2080,FACULDADE UNIVERSICA DE FILOSOFIA
2081,FACULDADE DE CIENCIAS GERENCIAS DE PEDREIRA
2082,FACULDADE DE CIENCIAS MEDICAS DA PARAIBA
2084,FACULDADE CNEC NOVA PETROPOLIS
2085,CENTRO UNIVERSITARIO DE SALVADOR
2086,INSTITUTO DE ENSINO SUPERIOR DE FOZ DO IGUACU
2087,FACULDADE MARECHAL RONDON
2088,INSTITUTO SUPERIOR DE EDUCACAO SANTO AGOSTINHO
2089,FACULDADE CENECISTA DE MOSSORO
2090,FACULDADE DE TURISMO DE CONGONHAS
2091,INSTITUTO SUPERIOR DE EDUCACAO PROSABER
2092,FACULDADE DOM PEDRO II
2093,FACULDADE GREGOR MENDEL
2094,FACULDADE DE ENSINO A
2095,INSITUTO SUPERIOR DE JACAREI
2096,FACULDADE DOCTUM DE MANHUACU  DOCTUM
2097,ESCOLA SUPERIOR DE GUARARAPES
2098,FACULDADE EXCELENCIA
2099,INSTITUTO DE ENSINO PESQUISA E EXTENSAO DO BRA
2100,FACULDADE DE LETRAS DO SERRO
2101,FACULDADE ASCENSAO
2102,FACULDADE DE AURIFLAMA
2103,FACULDADE E CENTRO DE ENSINO DE LONDRINA
2104,FACULDADE DE TEOLOGIA DE HOKEMAH
2105,FACULDADE ADVENTISTA DE INFORMATICA
2107,FACULDADE IBTE
2108,FACULDADE DE DIREITO DA SEDES
2109,FACULDADE JOAO PESSOA
2110,FACULDADE DOM CESAR
2111,CENTRO UNIVERSITARIO INTA
2112,FACULDADE METODISTA DE BIRIGUI
2113,FACULDADE DOM BOSCO DE PORTO ALEGRE
2114,FACULDADE DE TEOLOGIA FILADELFIA
2115,FACULDADE JOAO PAULO II
2116,FACULDADE IGUAPENSE SANTO AUGUSTO
2117,FACULDADE DE CIENCIA E TECNOLOGIA
2118,INSTITUTO DE EDUCACAO SUPERIOR GUAIANAS
2119,FACULDADE GUARARAPES
2120,INSTITUTO DE FILOSOFIA E DE TEOLOGIA PAULO VI
2121,FACULDADE DE INFORMATICA DE PEDREIRA
2122,CENTRO UNIVERSITARIO ESTACIO DE SERGIPE
2123,CENTRO UNIVERSITARIO MAX PLANCK
2124,FACULDADE CALAFIORI
2125,FACULDADE DE EDUCACAO DE UBERLANDIA
2126,ESCOLA DE DIREITO DO RIO DE JANEIRO
2127,FACULDADE BATISTA DE EDUCACAO
2128,ESCOLA DE DIREITO DE SAO PAULO  FGV DIREITO SP
2129,ESCOLA DE ECONOMIA DE SAO PAULO
2130,FACULDADE EVANGELICA DE TEOLOGIA DE BELO HORIZ
2131,FACULDADE DE SAO BERNARDO DO CAMPO
2132,CENTRO UNIVERSITARIO UNINORTE
2133,FACULDADE DE CIENCIAS  EDUCACAO E TEOLOGIA DO
2134,FACULDADE ASSEMBLEIANA DO BRASIL
2135,CENTRO UNIVERSITARIO CATOLICA DE QUIXADA
2136,INSTITUTO DE JUINA DE ENSINO SUPERIOR
2137,FACULDADE SAO MARCOS
2138,INSTITUTO SUPERIOR DE EDUCACAO DIVINO SALVADOR
2139,FACULDADE DE INFORMATICA DE PARANAIBA
2140,FACULDADE NOSSA SENHORA DE LOURDES
2141,FACULDADES BATISTA DO PARANA
2142,FACULDADE MULTIEDUC1
2143,INSTITUTO SUPERIOR DE EDUCACAO DE DUQUE DE CAX
2144,FACULDADE ECOPORANGA
2145,FACULDADE PROMOVE DE TECNOLOGIA
2146,FACULDADE DO ACRE
2147,CENTRO UNIVERSITARIO CEUNI  FAMETRO
2148,FACULDADE DE PALMAS
2149,FACULDADE MATO GROSSO DO SUL
2150,CENTRO UNIVERSITARIO DO PIAUI
2151,INSTITUTO SUPERIOR DE EDUCACAO BERLAAR
2152,FACULDADE DE ADMINISTRACAO E TECNOLOGIA
2153,FACULDADE DE DIREITO DE MACAE
2154,INSTITUTO SUPERIOR DE CIENCIAS HUMANAS E SOCIA
2155,FACULDADE DE CIENCIAS SOCIAIS E DA SAUDE DE CA
2156,FACULDADE SAO TOMAS DE AQUINO
2157,INSTITUTO SUPERIOR DE EDUCACAO SANTANA
2158,FACULDADE SANTA MARIA
2160,FACULDADE SANT ANA
2161,FACULDADE TEOLOGICA DE VALENCA
2162,INSTITUTO METROPOLITANO DE ENSINO SUPERIOR DE
2163,FACULDADE EUGENIO GOMES
2164,FACULDADE PANAMERICANA
2165,FACULDADE FOZ DO IGUACU
