Código IES,Nome da IES - Instituição de Ensino Superior
1,UNIVERSIDADE FEDERAL DE MATO GROSSO
2,UNIVERSIDADE DE BRASILIA
3,UNIVERSIDADE FEDERAL DE SERGIPE
4,UNIVERSIDADE FEDERAL DO AMAZONAS
5,UNIVERSIDADE FEDERAL DO PIAUI
6,UNIVERSIDADE FEDERAL DE OURO PRETO
7,UNIVERSIDADE FEDERAL DE SAO CARLOS
8,UNIVERSIDADE FEDERAL DE VICOSA
9,UNIVERSIDADE ESTADUAL DE LONDRINA
10,PONTIFICIA UNIVERSIDADE CATOLICA DO PARANA
11,UNIVERSIDADE CATOLICA DE PERNAMBUCO
12,UNIVERSIDADE FEDERAL DO RIO GRANDE
13,UNIVERSIDADE DE CAXIAS DO SUL
14,UNIVERSIDADE DO VALE DO RIO DOS SINOS
15,UNIVERSIDADE CATOLICA DE PETROPOLIS
16,UNIVERSIDADE GAMA FILHO
17,UNIVERSIDADE FEDERAL DE UBERLANDIA
18,UNIVERSIDADE CATOLICA DE PELOTAS
19,PONTIFICIA UNIVERSIDADE CATOLICA DE CAMPINAS
20,UNIVERSIDADE DE PASSO FUNDO
21,PONTIFICIA UNIVERSIDADE CATOLICA DO RIO GRANDE
22,UNIVERSIDADE PRESBITERIANA MACKENZIE
23,UNIVERSIDADE FEEVALE
24,UNIVERSIDADE ESTADUAL DE SANTA CRUZ
26,ESCOLA NACIONAL DE CIENCIAS ESTATISTICAS
27,UNIVERSIDADE VALE DO RIO VERDE
29,UNIVERSIDADE ESTADUAL DO CEARA
30,UNIVERSIDADE JOSE DO ROSARIO VELLANO
31,CENTRO DE EDUCACAO TECNICA DA UTRAMIG
32,UNIVERSIDADE ESTADUAL DE CIENCIAS DA SAUDE DE
33,FACULDADE DE TECNOLOGIA DE SOROCABA
34,FACULDADE DE TECNOLOGIA DE SAO PAULO
35,FACULDADE DE TECNOLOGIA DE AMERICANA
36,FACULDADE DE TECNOLOGIA RUBENS LARA
37,FACULDADE DE TECNOLOGIA DE JAHU
38,UNIVERSIDADE DO ESTADO DO PARA
39,INSTITUTO DE TECNOLOGIA DA AMAZONIA
40,UNIVERSIDADE DO ESTADO DA BAHIA
41,FACULDADE ESTADUAL DE EDUCACAO FISICA DE JACAR
42,FACULDADE ESTADUAL DE DIREITO DO NORTE PIONEIR
43,FUNDACAO UNIVERSIDADE DO ESTADO DE SANTA CATAR
44,FACULDADE DE ENGENHARIA CIVIL DE ITAJUBA
45,FACULDADE DE FILOSOFIA CIENCIAS E LETRAS DE IT
46,FACULDADE ESTADUAL DE CIENCIAS ECONOMICAS DE A
47,UNIVERSIDADE ESTADUAL DE GOIAS
54,UNIVERSIDADE ESTADUAL DE CAMPINAS
55,UNIVERSIDADE DE SAO PAULO
56,UNIVERSIDADE ESTADUAL PAULISTA JULIO DE MESQUI
57,UNIVERSIDADE ESTADUAL DE MARINGA
58,FACULDADE DE DIREITO DE SAO BERNARDO DO CAMPO
59,FACULDADE DE DIREITO DE FRANCA
60,CENTRO UNIVERSITARIO MUNICIPAL DE FRANCA
61,ESCOLA SUPERIOR DE EDUCACAO FISICA DE AVARE
62,FACULDADE DE CIENCIAS E LETRAS DE AVARE
63,FACULDADE DE CIENCIAS DE BARRETOS
64,FACULDADE DE ENGENHARIA DE BARRETOS
65,FACULDADE DE ODONTOLOGIA DE BARRETOS
66,FACULDADE DE DIREITO E ADMINISTRACAO DE BARRET
67,ESCOLA DE ENGENHARIA DE PIRACICABA
68,FACULDADE DE FILOSOFIA CIENCIAS E LETRAS DE PE
71,UNIVERSIDADE DO ESTADO DO RIO GRANDE DO NORTE
72,FACULDADE DE FORMACAO DE PROFESSORES DA MATA S
73,CENTRO DE ENSINO SUPERIOR DE ARCOVERDE
74,FACULDADE DE FILOSOFIA CIENCIAS E LETRAS DE SA
75,FACULDADE ESTADUAL DE EDUCACAO CIENCIAS E LETR
76,UNIVERSIDADE REGIONAL DE BLUMENAU
77,FACULDADE DA REGIAO DOS LAGOS
78,FACULDADE DE FILOSOFIA CIENCIAS E LETRAS DE AL
79,INSTITUTO MUNICIPAL DE ENSINO SUPERIOR DE CATA
80,CENTRO UNIVERSITARIO PARA O DESENVOLVIMENTO DO
81,UNIVERSIDADE DA REGIAO DE JOINVILLE
82,UNIVERSIDADE DO OESTE DE SANTA CATARINA
83,UNIVERSIDADE DO VALE DO ITAJAI
84,FACULDADE DE FILOSOFIA CIENCIAS E LETRAS DE MA
85,FACULDADE DE FILOSOFIA DE ITAPERUNA
86,FACULDADE DE CIENCIAS HUMANAS E SOCIAIS PADRE
87,CENTRO UNIVERSITARIO DE BRUSQUE
88,FACULDADE DE FORMACAO DE PROFESSORES DE PENEDO
89,FUNDACAO FACULDADES LUIZ MENEGHEL
90,ESCOLA SUPERIOR DE EDUCACAO CIENCIAS E LETRAS
91,ESCOLA SUPERIOR DE CIENCIAS AGRARIAS DE RIO VE
92,ESCOLA SUPERIOR CIENCIAS HUMANAS E EXATAS DE R
93,FACULDADE DE MEDICINA DE JUNDIAI
94,ESCOLA SUPERIOR DE EDUCACAO FISICA DE JUNDIAI
95,UNIVERSIDADE ESTADUAL VALE DO ACARAU
96,FACULDADE DE FILOSOFIA CIENCIAS E LETRAS PROFE
97,ESCOLA SUPERIOR DE AGRICULTURA E CIENCIAS DE M
98,FACULDADE DE ADMINISTRACAO E FINANCAS DE MACHA
99,FACULDADE DE DIREITO DE CONSELHEIRO LAFAIETE
100,FACULDADE DE FILOSOFIA CIENCIAS E LETRAS DE AR
101,FACULDADE DE CIENCIAS GERENCIAIS DO ALTO PARAN
102,FACULDADE DE DIREITO DO ALTO PARANAIBA
103,FACULDADE DE FILOSOFIA CIENCIAS E LETRAS DE AR
104,FACULDADE DE CIENCIAS ECONOMICAS DE PATOS
105,FACULDADE DE FILOSOFIA CIENCIAS E LETRAS DE PA
106,FACULDADE DE EDUCACAO DE PATOS
107,UNIVERSIDADE FEDERAL DE SAO JOAO DEL REI
108,ESCOLA SUPERIOR DE EDUCACAO FISICA E TECNICAS
109,FACULDADES INTEGRADAS RUI BARBOSA
110,FACULDADE DE DIREITO DE SETE LAGOAS
111,FACULDADE DE FILOSOFIA CIENCIAS E LETRAS DE SE
122,FACULDADE DE ENGENHARIA DE AGRIMENSURA DE ARAR
123,FACULDADE DE ENGENHARIA CIVIL DE ARARAQUARA
124,UNIVERSIDADE DE ARARAQUARA
125,CENTRO UNIVERSITARIO DE ARARAS
126,INSTITUTO NACIONAL DE TELECOMUNICACOES
127,FACULDADE DE CIENCIAS SOCIAIS APLICADAS DE ATI
128,FACULDADE DE FILOSOFIA CIENCIAS E LETRAS DE TE
129,FACULDADE DE DIREITO DE TEOFILO OTONI
130,FACULDADE DE ADMINISTRACAO DE TEOFILO OTONI
131,FACULDADE DE EDUCACAO FISICA DE BARRA BONITA
132,FACULDADE DE EDUCACAO ANTONIO AUGUSTO REIS NEV
133,FACULDADE DE CIENCIAS CONTABEIS DE BARRETOS
134,FACULDADE DE TECNOLOGIA E PROCESSAMENTO DE DAD
135,CENTRO UNIVERSITARIO CLARETIANO
136,FACULDADE DE FILOSOFIA CIENCIAS E LETRAS DE BE
137,CENTRO UNIVERSITARIO SAGRADO CORACAO
138,CENTRO UNIVERSITARIO BARAO DE MAUA
139,FACULDADE DE CIENCIAS ECONOMICAS DO TRIANGULO
140,UNIVERSIDADE DE VASSOURAS
141,FACULDADE DE DIREITO DE VARGINHA  FADIVA
142,CENTRO UNIVERSITARIO DO TRIANGULO
143,UNIVERSIDADE DE UBERABA
144,FACULDADE DE CIENCIAS HUMANAS DE OLINDA
145,FACULDADE DE CIENCIAS HUMANAS E SOCIAIS
146,CENTRO UNIVERSITARIO DE RIO PRETO
149,FACULDADE DE MEDICINA DE SAO JOSE DO RIO PRETO
150,UNIVERSIDADE DE SOROCABA
151,ESCOLA DE ADMINISTRACAO DE EMPRESAS DE SAO PAU
152,FACULDADE DE CIENCIAS CONTABEIS
158,CONSERVATORIO BRASILEIRO DE MUSICA  CENTRO UNI
159,FACULDADE DE FILOSOFIA CIENCIAS E LETRAS DE CA
160,FACULDADE FRASSINETTI DO RECIFE
161,CENTRO UNIVERSITARIO ASSUNCAO
162,CENTRO UNIVERSITARIO BELAS ARTES DE SAO PAULO
163,UNIVERSIDADE ESTACIO DE SA
165,UNIVERSIDADE VEIGA DE ALMEIDA
166,FAI  CENTRO DE ENSINO SUPERIOR EM GESTAO  TECN
167,UNIVERSIDADE METODISTA DE SAO PAULO
170,FUNVIC  FACULDADE FUNVIC DE MOCOCA
171,FACULDADE DE DIREITO DO SUL DE MINAS
172,FACULDADE DE FILOSOFIA CIENCIAS E LETRAS EUGEN
173,FACULDADE DE CIENCIAS MEDICAS DR JOSE ANTONIO
174,INSTITUTO SUPERIOR DE ESTUDOS SOCIAIS CLOVIS B
176,UNIVERSIDADE CASTELO BRANCO
177,FACULDADE DE CIENCIAS ECONOMICAS E DE ADMINIST
178,FACULDADE DE ENGENHARIA DE SAO JOSE DO RIO PRE
179,FACULDADE DE ARQUITETURA E URBANISMO DE SAO JO
180,FACULDADE DE DIREITO DE CARUARU
181,FACULDADE DE ODONTOLOGIA DE CARUARU
190,ESCOLA DE MEDICINA SOUZA MARQUES DA FUNDACAO T
191,FACULDADE DE CIENCIAS CONTABEIS E DE ADMINISTR
192,FACULDADE DE FILOSOFIA CIENCIAS E LETRAS SOUZA
193,FACULDADE DE ENGENHARIA SOUZA MARQUES
194,ESCOLA DE ENFERMAGEM DA FUNDACAO TECNICO EDUCA
195,FACULDADE PRESBITERIANA MACKENZIE RIO
197,FACULDADE DE EDUCACAO SUPERIOR DO PARANA
198,CENTRO UNIVERSITARIO DA CIDADE
199,FACULDADE SAO LUIS
200,FACULDADE CASPER LIBERO
201,FACULDADE BRASILEIRA DE CIENCIAS JURIDICAS
202,FACULDADE DO RIO DE JANEIRO
203,UNIVERSIDADE SAO JUDAS TADEU
206,CENTRO UNIVERSITARIO ITALOBRASILEIRO
207,CENTRO UNIVERSITARIO MOURA LACERDA
208,UNIVERSIDADE DE RIBEIRAO PRETO
210,FACULDADE DE FILOSOFIA CIENCIAS E LETRAS DE SA
211,FACULDADE DE CIENCIAS ECONOMICAS E ADMINISTR1S
212,FACULDADE DE FILOSOFIA DE CAMPO GRANDE
213,CENTRO UNIVERSITARIO ALVARES PENTEADO
214,FACULDADE DE ENGENHARIA DE MINAS GERAIS  FEAMI
215,UNIVERSIDADE DO GRANDE ABC
216,CENTRO UNIVERSITARIO METODISTA IZABELA HENDRIX
217,CENTRO UNIVERSITARIO DAS FACULDADES ASSOCIADAS
218,FACULDADE DE FILOSOFIA CIENCIAS E LETRAS DE DU
219,FACULDADE DE EDUCACAO CIENCIAS E ARTES DOM BOS
220,FACULDADE SAO JUDAS TADEU
221,UNIVERSIDADE CRUZEIRO DO SUL
222,CENTRO UNIVERSITARIO DE VOTUPORANGA
223,FACULDADE DE EDUCACAO FISICA DE SANTO ANDRE
224,CENTRO UNIVERSITARIO SAUDE ABC
225,FACULDADE DE SANTO ANDRE
226,CENTRO UNIVERSITARIO LUSIADA
227,UNIVERSIDADE CATOLICA DE SANTOS
228,FACULDADE DE ENGENHARIA INDUSTRIAL DE SAO BERN
229,ESCOLA SUPERIOR DE ADMINISTRACAO DE NEGOCIOS D
230,ESCOLA SUPERIOR DE ADMINISTRACAO DE NEGOCIOS D
231,FACULDADE DE SAO BERNARDO DO CAMPO  FASB
234,FACULDADES OSWALDO CRUZ
236,FACULDADE DE CIENCIAS CONTABEIS E ADMINISTR1S
237,FACULDADE DE DIREITO DE SAO JOAO DA BOA VISTA
238,FACULDADE DE FILOSOFIA CIENCIAS E LETRAS DE SA
239,FACULDADE DE MEDICINA VETERINARIA OCTAVIO BAST
240,UNIVERSIDADE SANTA URSULA
241,FACULDADE DE ENGENHARIA QUIMICA DE LORENA
242,CENTRO UNIVERSITARIO ANHANGUERA DE SANTO ANDRE
243,FACULDADE DO CLUBE NAUTICO MOGIANO
244,CENTRO UNIVERSITARIO FIEO
245,FACULDADE DE ADMINISTRACAO
254,CENTRO UNIVERSITARIO UNIBAN
255,FACULDADE DE ENGENHARIA E AGRIMENSURA DE PIRAS
256,FACULDADE DE PIRAJU
257,FACULDADE DE ADMINISTRACAO E CIENCIAS CONTABEI
263,FACULDADES INTEGRADAS CAMPOS SALLES
264,UNIVERSIDADE SAO MARCOS
265,CENTRO UNIVERSITARIO DAS FACULDADES INTEGRADAS
266,UNIVERSIDADE METODISTA DE PIRACICABA
267,CENTRO UNIVERSITARIO ESPIRITOSANTENSE/FAESA
268,FACULDADE DE DIREITO DA ALTA PAULISTA
269,FACULDADE FACCAT
270,FACULDADE DE TUPA
271,UNIVERSIDADE DO OESTE PAULISTA
273,ESCOLA DE ENGENHARIA INDUSTRIAL DE SAO JOSE DO
274,FACULDADE DE CIENCIAS APLICADAS DE SAO JOSE DO
275,UNIVERSIDADE DO VALE DO PARAIBA
276,FACULDADE DE DIREITO DE SOROCABA
277,CENTRO UNIVERSITARIO AUGUSTO MOTTA
278,FACULDADES INTEGRADAS SIMONSEN
279,FACULDADES INTEGRADAS HELIO ALONSO
280,FACULDADE DE DIREITO DO OESTE DE MINAS
281,CONSERVATORIO DRAMATICO MUSICAL SAO PAULO
282,FACULDADE DE CIENCIAS ADMINISTR1S E CONTABEIS
283,FACULDADE DE EDUCACAO COSTA BRAGA
284,FACULDADE DE MEDICINA DE ITAJUBA
288,FACULDADE DE DIREITO DO VALE DO RIO DOCE
289,FACULDADE DE EDUCACAO DE JOINVILLE
290,FACULDADE DE DIREITO DE JOINVILLE
291,FACULDADE DE PSICOLOGIA DE JOINVILLE
292,FACULDADE DE CIENCIAS DA SAUDE DE JOINVILLE
293,FACULDADE DE CIENCIAS E TECNOLOGIA DE JOINVILL
294,FACULDADE TRES DE MAIO
295,UNIVERSIDADE DE SANTA CRUZ DO SUL
296,CENTRO UNIVERSITARIO DA REGIAO DA CAMPANHA
297,FACULDADE DE CIENCIAS CONTABEIS E ADMINISTR1S
298,UNIVERSIDADE PITAGORAS UNOPAR
299,FACULDADE DE JANDAIA DO SUL
300,FACULDADE DE FILOSOFIA CIENCIAS E LETRAS DE FO
301,ESCOLA DE BIBLIOTECONOMIA
302,FACULDADE DIVINOPOLIS
303,FACULDADE DE FILOSOFIA CIENCIAS E LETRAS DE CA
304,FACULDADE DE CIENCIAS CONTABEIS DE CARATINGA
307,FACULDADE DE MEDICINA DE BARBACENA
308,CENTRO UNIVERSITARIO PRESIDENTE ANTONIO CARLOS
316,UNIVERSIDADE NOVE DE JULHO
317,FACULDADES INTEGRADAS ALCANTARA MACHADO
318,FACULDADE DE ARTES ALCANTARA MACHADO
319,UNIVERSIDADE BRASIL
320,FACULDADE DE FILOSOFIA CIENCIAS E LETRAS DE TA
321,FACULDADE UNIDAS DE TATUI
322,UNIVERSIDADE PAULISTA
328,FACULDADE DE CIENCIAS JURIDICAS E SOCIAIS VIAN
329,ESCOLA SUPERIOR DE AGRONOMIA DE PARAGUACU PAUL
330,UNIVERSIDADE IGUACU
332,ESCOLA DE ENGENHARIA DE LINS
333,FACULDADE DE INFORMATICA DE LINS
334,FACULDADE DE SERVICO SOCIAL DE LINS
335,FACULDADE DE EDUCACAO E CIENCIAS PINHEIRENSE
336,FACULDADE MACHADO SOBRINHO
337,CENTRO DE ENSINO SUPERIOR DE JUIZ DE FORA
338,PONTIFICIA UNIVERSIDADE CATOLICA DE MINAS GERA
339,FACULDADE DE JOAO PESSOA (SANTA EMILIA DO RODA
343,CENTRO UNIVERSITARIO NEWTON PAIVA
344,CENTRO UNIVERSITARIO UNA
345,ESCOLA DE ENGENHARIA KENNEDY
346,INSTITUTO SUPERIOR DE CIENCIAS APLICADAS  ISCA
349,CENTRO UNIVERSITARIO DE BELO HORIZONTE
351,FACULDADE DE CIENCIAS MEDICAS DE MINAS GERAIS
352,CENTRO UNIVERSITARIO DE JOAO PESSOA
353,FACULDADE EVANGELICA MACKENZIE DO PARANA
355,UNIVERSIDADE TUIUTI DO PARANA
359,ESCOLA SUPERIOR DE EDUCACAO FISICA DE MUZAMBIN
360,CENTRO UNIVERSITARIO PAULISTANO
361,FACULDADE PAULISTA DE SERVICO SOCIAL DE SAO CA
362,FACULDADE PAULISTA DE SERVICO SOCIAL
363,FACULDADE MOZARTEUM DE SAO PAULO
364,FACULDADE DE CIENCIAS CONTABEIS DE PONTE NOVA
367,UNIVERSIDADE ESTADUAL DE MONTES CLAROS
368,FACULDADE DE EDUCACAO FISICA DA ASSOCIACAO CRI
369,FACULDADE AUXILIUM DE FILOSOFIA CIENCIAS E LET
370,FACULDADE PAULISTA DE ARTES
371,FACULDADE DE MUSICA CARLOS GOMES
372,FACULDADE DE BIBLIOTECONOMIA E CIENCIA DA INFO
373,ESCOLA DE SOCIOLOGIA E POLITICA DE SAO PAULO
374,CENTRO UNIVERSITARIO DAS FACULDADES METROPOLIT
375,UNIVERSIDADE SANTO AMARO
376,CENTRO UNIVERSITARIO ANHANGUERA DE SAO PAULO
377,FACULDADE DE EDUCACAO PADRE ANCHIETA
378,FACULDADE DE DIREITO PADRE ANCHIETA
379,FACULDADE DE CIENCIAS E LETRAS PADRE ANCHIETA
380,FACULDADE DE CIENCIAS ECONOMICAS CONTABEIS E D
381,FACULDADE DE PSICOLOGIA PADRE ANCHIETA
382,FACULDADE DE TECNOLOGIA PADRE ANCHIETA
383,UNIVERSIDADE DA AMAZONIA
384,CENTRO UNIVERSITARIO DE ANAPOLIS
385,UNIVERSIDADE SALVADOR
386,CENTRO UNIVERSITARIO DE GOIAS
387,UNIVERSIDADE CATOLICA DOM BOSCO
388,FACULDADE DE CIENCIAS CONTABEIS E ATUARIAIS DA
389,FACULDADE DE CIENCIAS ADMINISTRATIVAS E CONTAB
390,FACULDADE DE EDUCACAO FISICA DE LINS
391,FACULDADE DE TECNOLOGIA DA ALTA NOROESTE
395,FACULDADE DE CIENCIAS CONTABEIS DE LUCELIA
396,CENTRO UNIVERSITARIO RUY BARBOSA WYDEN
397,FACULDADE RUY BARBOSA DE TECNOLOGIA EM PROCESS
398,UNIVERSIDADE TIRADENTES
399,ESCOLA DE ENGENHARIA DE AGRIMENSURA
400,FACULDADE DE DIREITO DE OLINDA
401,CENTRO DE ESTUDOS SUPERIORES BARROS MELO
402,CENTRO UNIVERSITARIO DE BRASILIA
403,UNIVERSIDADE CATOLICA DE BRASILIA
404,FACULDADES INTEGRADAS DA UPIS
405,FOCCA  FACULDADE DE OLINDA
408,ESCOLA SUPERIOR DE RELACOES PUBLICAS
409,UNIVERSIDADE DE PERNAMBUCO
410,FACULDADE DE CIENCIAS HUMANAS ESUDA
413,FACULDADE PORTOALEGRENSE DE EDUCACAO CIENCIAS
414,FACULDADE PORTOALEGRENSE DE CIENCIAS CONTABEIS
415,FACULDADE DE CIENCIAS MEDICAS DA SANTA CASA SA
416,FACULDADE DE SAO PAULO
417,UNIVERSIDADE CIDADE DE SAO PAULO
420,UNIVERSIDADE DE MARILIA
421,FACULDADE ESTADUAL DE CIENCIAS E LETRAS DE CAM
423,UNIVERSIDADE REGIONAL INTEGRADA DO ALTO URUGUA
424,FACULDADE DE CIENCIAS CONTABEIS E ADMINISTR1S
425,FACULDADE DE EDUCACAO ARTISTICA DE SANTA ROSA
426,UNIVERSIDADE FRANCISCANA
428,FACULDADE DE CIENCIAS CONTABEIS E DE ADMINISTR
429,FACULDADE DE DIREITO DE MARILIA
430,CENTRO UNIVERSITARIO FILADELFIA
431,FACULDADE DE MEDICINA DE MARILIA
432,FACULDADE PARANAENSE
433,FACULDADE DE FILOSOFIA CIENCIAS E LETRAS DE PA
434,FACULDADE SANTA MARCELINA
435,FACULDADE SANTA MARCELINA MURIAE  FASM
437,UNIVERSIDADE PARANAENSE
438,FACULDADE DE FILOSOFIA CIENCIAS E LETRAS DE IT
439,FACULDADE DOUTOR FRANCISCO MAEDA
440,FACULDADE DE DIREITO DE ITU
441,UNIVERSIDADE DO CONTESTADO
442,FACULDADE DE FILOSOFIA CIENCIAS E LETRAS DE IT
443,FACULDADE DE CIENCIAS CONTABEIS E ADMINISTR1S
446,UNIVERSIDADE DE CRUZ ALTA
447,FACULDADE CATOLICA DE CIENCIAS ECONOMICAS DA B
448,CENTRO UNIVERSITARIO RITTER DOS REIS
449,UNIVERSIDADE LUTERANA DO BRASIL
450,CENTRO UNIVERSITARIO SAO LUCAS JIPARANA
451,CENTRO UNIVERSITARIO LUTERANO DE SANTAREM
452,CENTRO UNIVERSITARIO LUTERANO DE MANAUS
453,CENTRO UNIVERSITARIO LUTERANO DE PALMAS
454,FACULDADE CAMAQUENSE DE CIENCIAS CONTABEIS E A
455,FACULDADE DE FORMACAO DE PROFESSORES E ESPECIA
456,CENTRO UNIVERSITARIO SANT¿ANNA
457,UNIVERSIDADE ANHANGUERA DE SAO PAULO
458,UNIVERSIDADE IBIRAPUERA
459,FACULDADE RENASCENCA
460,FACULDADE DE ARTES PLASTICAS DA FUNDACAO ARMAN
461,FACULDADE ARMANDO ALVARES PENTEADO
462,FACULDADE DE ENGENHARIA DA FUNDACAO ARMANDO AL
463,FACULDADE DE COMUNICACAO E MARKETING DA FUNDAC
464,FACULDADE DE ECONOMIA DA FUNDACAO ARMANDO ALVA
465,FACULDADE DE COMPUTACAO E INFORMATICA DA FUNDA
466,UNIVERSIDADE ANHEMBI MORUMBI
467,FACULDADE DE CIENCIAS CONTABEIS DE ITAPETINING
468,FACULDADE DE FILOSOFIA  CIENCIAS E LETRAS DE I
469,ABEU FACULDADES INTEGRADAS
470,FACULDADE DE ODONTOLOGIA DE NOVA FRIBURGO
472,UNIVERSIDADE DO GRANDE RIO PROFESSOR JOSE DE S
473,FACULDADE DE CIENCIAS ECONOMICAS  ADMINISTRATI
474,FACULDADE DE FILOSOFIA CIENCIAS E LETRAS DOM B
475,FACULDADE DE MEDICINA DE PETROPOLIS
480,CENTRO UNIVERSITARIO SERRA DOS ORGAOS
481,UNIVERSIDADE UNIVERSUS VERITAS GUARULHOS
482,UNIVERSIDADE DO EXTREMO SUL CATARINENSE
483,CENTRO UNIVERSITARIO METROPOLITANO DE SAO PAUL
487,FACULDADE DE ADMINISTRACAO CIENCIAS CONTABEIS
488,ESCOLA SUPERIOR DE CIENCIAS HUMANAS FISICAS E
489,CENTRO UNIVERSITARIO DE VOLTA REDONDA
490,CENTRO UNIVERSITARIO DE VALENCA
491,CENTRO UNIVERSITARIO DON DOMENICO
492,FACULDADE DE ADMINISTRACAO CIENCIAS ECON E CON
493,FACULDADE DE EDUCACAO DE GUARATINGUETA
494,UNIVERSIDADE DO SUL DE SANTA CATARINA
495,FACULDADE DE CIENCIAS E LETRAS DE BRAGANCA PAU
496,UNIVERSIDADE DE FRANCA
498,ESCOLA SUPERIOR DE EDUCACAO FISICA E DESPORTOS
499,FACULDADE DE DIREITO E ADMINISTRACAO CATANDUVA
500,FACULDADE DE MEDICINA DE CATANDUVA
501,ESCOLA SUPERIOR DE CIENCIAS DA SANTA CASA DE M
502,CENTRO UNIVERSITARIO SAO JUDAS TADEU
503,FACULDADE DE DIREITO DE CAMPOS
504,FACULDADE DE ODONTOLOGIA DE CAMPOS
505,FACULDADE DE FILOSOFIA DE CAMPOS
506,FACULDADE DE MEDICINA DE CAMPOS
507,FACULDADE MAIS DE ITUIUTABA
508,FACULDADE DE CIENCIAS SOCIAIS APLICADAS DO SUL
509,FACULDADES INTEGRADAS DE CRUZEIRO
510,FACULDADE WENCESLAU BRAZ
511,FACULDADE DE FILOSOFIA CIENCIAS E LETRAS DE GU
512,FACULDADE DE CIENCIAS ADMINISTR1S ECONOMICAS E
513,UNIVERSIDADE VALE DO RIO DOCE
514,CENTRO UNIVERSITARIO DE BARRA MANSA
515,CENTRO UNIVERSITARIO ANHANGUERA DE NITEROI
516,CENTRO UNIVERSITARIO DO RIO DE JANEIRO
517,FACULDADE DE EDUCACAO SAO LUIS
518,CENTRO UNIVERSITARIO DO DISTRITO FEDERAL
519,UNIVERSIDADE CATOLICA DO SALVADOR
521,UNIVERSIDADE DE MOGI DAS CRUZES
522,CENTRO UNIVERSITARIO CELSO LISBOA
524,FACULDADE DE FILOSOFIA CIENCIAS E LETRAS DE OU
526,CENTRO UNIVERSITARIO BRAZ CUBAS
527,PONTIFICIA UNIVERSIDADE CATOLICA DE GOIAS
528,PONTIFICIA UNIVERSIDADE CATOLICA DO RIO DE JAN
530,FACULDADE DE MUSICA DO ESPIRITO SANTO
531,FACULDADE DE FORMACAO DE PROFESSORES DE VITORI
532,UNIVERSIDADE REGIONAL DO NOROESTE DO ESTADO DO
533,FACULDADES INTEGRADAS DE ITAPETININGA
534,ESCOLA BAHIANA DE MEDICINA E SAUDE PUBLICA
535,CENTRO UNIVERSITARIO DE MANDAGUARI  UNIMAN
543,FACULDADE DE CIENCIAS DA FUNDACAO INSTITUTO TE
544,FACULDADE DE CIENCIAS HUMANAS DE ITABIRA
545,FACULDADE DE DESENVOLVIMENTO DAS CIENCIAS E HU
546,PONTIFICIA UNIVERSIDADE CATOLICA DE SAO PAULO
547,UNIVERSIDADE DO ESTADO DO RIO DE JANEIRO
548,UNIVERSIDADE FEDERAL DO MARANHAO
549,UNIVERSIDADE FEDERAL DO ACRE
550,UNIVERSIDADE ESTADUAL DA PARAIBA
552,FACULDADE DE FILOSOFIA CIENCIAS E LETRAS DE CA
553,FACULDADE DE CIENCIAS ADMINISTR1S DE CARATINGA
554,FACULDADE DE FILOSOFIA  CIENCIAS E LETRAS DE B
555,UNIVERSIDADE DE FORTALEZA
556,CONSERVATORIO DE MUSICA DE NITEROI
557,ESCOLA DE MUSICA E BELAS ARTES DO PARANA
558,FACULDADE DE ARTES DO PARANA
568,UNIVERSIDADE ESTADUAL DO MARANHAO
569,UNIVERSIDADE FEDERAL DO PARA
570,UNIVERSIDADE FEDERAL DO RIO GRANDE DO NORTE
571,UNIVERSIDADE FEDERAL DO PARANA
572,UNIVERSIDADE FEDERAL FLUMINENSE
573,UNIVERSIDADE FEDERAL DO ESPIRITO SANTO
574,UNIVERSIDADE FEDERAL RURAL DO RIO DE JANEIRO
575,UNIVERSIDADE FEDERAL DE MINAS GERAIS
576,UNIVERSIDADE FEDERAL DE JUIZ DE FORA
577,UNIVERSIDADE FEDERAL DE ALAGOAS
578,UNIVERSIDADE FEDERAL DA BAHIA
579,UNIVERSIDADE FEDERAL DA PARAIBA
580,UNIVERSIDADE FEDERAL DE PERNAMBUCO
581,UNIVERSIDADE FEDERAL DO RIO GRANDE DO SUL
582,UNIVERSIDADE FEDERAL DE SANTA MARIA
583,UNIVERSIDADE FEDERAL DO CEARA
584,UNIVERSIDADE FEDERAL DE GOIAS
585,UNIVERSIDADE FEDERAL DE SANTA CATARINA
586,UNIVERSIDADE FEDERAL DO RIO DE JANEIRO
587,UNIVERSIDADE FEDERAL RURAL DE PERNAMBUCO
588,UNIVERSIDADE TECNOLOGICA FEDERAL DO PARANA
589,UNIVERSIDADE FEDERAL RURAL DO SEMIARIDO
590,UNIVERSIDADE FEDERAL RURAL DA AMAZONIA
591,UNIVERSIDADE FEDERAL DE SAO PAULO
592,UNIVERSIDADE FEDERAL DE LAVRAS
593,CENTRO FEDERAL DE EDUCACAO TECNOLOGICA CELSO S
594,CENTRO FEDERAL DE EDUCACAO TECNOLOGICA DE MINA
595,UNIVERSIDADE FEDERAL DE ALFENAS
596,UNIVERSIDADE FEDERAL DOS VALES DO JEQUITINHONH
597,UNIVERSIDADE FEDERAL DO TRIANGULO MINEIRO
598,UNIVERSIDADE FEDERAL DE ITAJUBA  UNIFEI
599,INSTITUTO FEDERAL DE EDUCACAO  CIENCIA E TECNO
600,INSTITUTO FEDERAL DE EDUCACAO  CIENCIA E TECNO
601,INSTITUTO FEDERAL DE EDUCACAO  CIENCIA E TECNO
602,INSTITUTO TECNOLOGICO DE AERONAUTICA
605,UNIVERSIDADE MUNICIPAL DE SAO CAETANO DO SUL
606,FACULDADE DE DIREITO DE CACHOEIRO DO ITAPEMIRI
607,FACULDADE DE CIENCIAS CONTABEIS E ADMINISTRATI
608,"\ESCOLA SUPERIOR DE CRUZEIRO \""\""PREFEITO HA"
609,UNIVERSIDADE ESTADUAL DO OESTE DO PARANA
610,CENTRO UNIVERSITARIO UNIVERSUS VERITAS
614,FACULDADE DE FILOSOFIA SANTA DOROTEIA
615,FACULDADE DE FILOSOFIA CIENCIAS E LETRAS PROFE
616,FACULDADE DE FILOSOFIA CIENCIAS E LETRAS DE GU
617,FACULDADE DE ENFERMAGEM E OBSTETRICIA DE GUARU
618,FACULDADE DE FISIOTERAPIA DE GUARULHOS
621,CENTRO UNIVERSITARIO CESMAC
622,FACULDADES INTEGRADAS SILVA E SOUZA
623,FACULDADES DE FILOSOFIA CIENCIAS E LETRAS DE S
624,FACULDADE DE FILOSOFIA CIENCIAS E LETRAS CARLO
625,FACULDADE CENECISTA DE CAPIVARI
626,CENTRO UNIVERSITARIO CENECISTA DE OSORIO
627,FACULDADE CNEC VARGINHA
629,FACULDADE CENECISTA DE VITORIA FACEV
630,FACULDADE CENECISTA DE CIENCIAS ADMINISTR1S DE
631,FACULDADE CNEC FARROUPILHA
632,FACULDADE DE CIENCIAS ECONOMICAS ADMINISTR1S E
633,INSTITUTO MILITAR DE ENGENHARIA
634,UNIVERSIDADE FEDERAL DE PELOTAS
636,ESCOLA SUPERIOR DE PROPAGANDA E MARKETING
637,FACULDADE DE ENGENHARIA SAO PAULO
638,FACULDADE DE DIREITO MILTON CAMPOS
639,FACULDADE DE DESENHO INDUSTRIAL DE MAUA
640,FACULDADES INTEGRADAS MARIA THEREZA
641,UNIVERSIDADE LA SALLE
645,CENTRO UNIVERSITARIO  CATOLICA DE SANTA CATARI
646,FACULDADES ASSOCIADAS DE SAO PAULO
647,FACULDADE DE ENFERMAGEM LUIZA DE MARILLAC
648,FACULDADES ASSOCIADAS DE UBERABA  FAZU
649,CENTRO UNIVERSITARIO DE UNIAO DA VITORIA
650,FACULDADE DE AVARE
651,FACULDADE DE ADMINISTRACAO DE GOVERNADOR VALAD
652,FACULDADE SANTA CECILIA
657,FACULDADE DE FORMACAO DE PROFESSORES DE SERRA
659,FACULDADE DE CIENCIAS HUMANAS DO SUL PAULISTA
660,FACULDADE METODISTA DO SUL PAULISTA
661,FACULDADE PIO DECIMO
662,FACULDADES INTEGRADAS CORACAO DE JESUS
663,UNIVERSIDADE SALGADO DE OLIVEIRA
664,UNIVERSIDADE VILA VELHA
665,UNIVERSIDADE DE TAUBATE
666,UNIVERSIDADE ESTADUAL DE FEIRA DE SANTANA
667,FACULDADES INTEGRADAS DE JACAREPAGUA
668,CENTRO UNIVERSITARIO DE ENSINO SUPERIOR DO AMA
669,UNIVERSIDADE NILTON LINS
670,UNIVERSIDADE SAO FRANCISCO
671,UNIVERSIDADE ANHANGUERA
672,CENTRO UNIVERSITARIO FACENS
673,CENTRO UNIVERSITARIO DA GRANDE DOURADOS
674,CENTRO DE ENSINO SUPERIOR DO VALE SAO FRANCISC
677,FACULDADES REUNIDAS DA ASCE
678,FACULDADE DE ODONTOLOGIA DO PLANALTO CENTRAL
679,FACULDADE DE REABILITACAO DO PLANALTO CENTRAL
680,FACULDADES INTEGRADAS DE PEDRO LEOPOLDO
681,FACULDADES INTEGRADAS ANGLOAMERICANO
682,FACULDADE DO NOROESTE DE MINAS
683,FACULDADE DE CIENCIAS ECONOMICAS DE COLATINA
684,FACULDADE DE FILOSOFIA CIENCIAS E LETRAS DE CO
685,FACULDADE DO BELO JARDIM
686,FACULDADE DE CIENCIAS APLICADAS DE LIMOEIRO
687,FACULDADE ESTADUAL DE FILOSOFIA CIENCIAS LETRA
688,UNIVERSIDADE ESTADUAL DO SUDOESTE DA BAHIA
689,FACULDADE DE NUTRICAO E FONOAUDIOLOGIA
690,FACULDADE DE CIENCIAS CONTABEIS E ADMINISTR1S
691,FACULDADE DE EDUCACAO DE TAQUARA
692,FACULDADE DE CIENCIAS APLICADAS E SOCIAIS DE P
693,UNIVERSIDADE FEDERAL DO ESTADO DO RIO DE JANEI
694,UNIVERSIDADE FEDERAL DE MATO GROSSO DO SUL
695,FACULDADE DE FILOSOFIA CIENCIAS E LETRAS DE IT
696,FACULDADE DE CIENCIAS AGRARIAS DE ITUMBIARA
697,FACULDADE DE ADMINISTRACAO DE EMPRESAS DE ITUM
699,FUNDACAO UNIVERSIDADE FEDERAL DE RONDONIA
700,FACULDADE DE EDUCACAO DE ITABORAI
701,FACULDADES INTEGRADAS DE GARANHUNS
702,FACULDADE  DE CIENCIAS E TECNOLOGIA PROFESSOR
703,FACULDADE DE FORMACAO DE PROFESSORES DE ARARIP
704,FACULDADE DE CIENCIAS AGRARIAS DE ARARIPINA
705,CENTRO UNIVERSITARIO SAO JOSE
706,FACULDADE DE ARTES DULCINA DE MORAES
707,CENTRO UNIVERSITARIO CENTRAL PAULISTA
708,INSTITUTO DE CIENCIAS SOCIAIS APLICADAS
709,INSTITUTO DE CIENCIAS EXATAS
710,FACULDADE BETHENCOURT DA SILVA
711,FACULDADES REUNIDAS DE ADMINISTRACAO CIENCIAS
712,CENTRO UNIVERSITARIO IBMR
713,ESCOLA SUPERIOR DE ESTATISTICA DA BAHIA
714,FACULDADE ESTADUAL DE FILOSOFIA CIENCIAS E LET
715,FAE CENTRO UNIVERSITARIO
716,FACULDADES INTEGRADAS DE BOTUCATU
717,FUNDACAO UNIVERSIDADE FEDERAL DE CIENCIAS DA S
718,UNIVERSIDADE POTIGUAR
719,UNIVERSIDADE DO ESTADO DE MATO GROSSO CARLOS A
720,FACULDADE DE CIENCIAS HUMANAS E SOCIAIS APLICA
721,FACULDADE DE EDUCACAO DE ASSIS
722,ESCOLA DE EDUCACAO FISICA DE ASSIS
723,FACULDADE DE ADMINISTRACAO DE ASSIS
724,CENTRO UNIVERSITARIO FACEX
725,FACULDADE ESTADUAL DE FILOSOFIA CIENCIAS E LET
726,FACULDADE ESTADUAL DE FILOSOFIA CIENCIAS E LET
727,FACULDADE DE FILOSOFIA  CIENCIAS E LETRAS DO A
728,FACULDADE DE CIENCIAS HUMANAS DE CURVELO
729,FACULDADE DE FILOSOFIA CIENCIAS E LETRAS DE PR
730,UNIVERSIDADE ESTADUAL DE PONTA GROSSA
734,FACULDADES INTEGRADAS MARIA IMACULADA
736,FACULDADE PITAGORAS DE LINHARES
737,CENTRO UNIVERSITARIO SAO CAMILO
738,CENTRO UNIVERSITARIO TERESA D AVILA
739,CENTRO UNIVERSITARIO SAO CAMILO  ESPIRITO SANT
740,FACULDADE DE CIENCIAS HUMANAS DE VITORIA
741,ESCOLA SUPERIOR DE SECRETARIADO DE PERNAMBUCO
742,FACULDADE DE ARQUITETURA E URBANISMO DE PERNAM
743,ESCOLA SUPERIOR DE ENSINO HELENA ANTIPOFF
744,FACULDADE DE ANICUNS
745,INSTITUTO MUNICIPAL DE ENSINO SUPERIOR DE SAO
746,UNIVERSIDADE REGIONAL DO CARIRI
747,FACULDADE DE CIENCIAS HUMANAS DE IVAIPORA
749,CENTRO DE ENSINO SUPERIOR DO VALE DO PARNAIBA
750,UNIVERSIDADE DE GURUPI
751,FACULDADE DA ILHA
752,FACULDADE DE PARA DE MINAS
753,FACULDADE DE CIENCIAS HUMANAS DO SERTAO CENTRA
754,CENTRO SUPERIOR UNA DE CATALAO
755,CENTRO DE ENSINO SUPERIOR DE JATAI
756,UNIVERSIDADE ESTADUAL DO PIAUI
757,CENTRO UNIVERSITARIO DA AMAZONIA
758,FACULDADE BRASILEIRA DE RECURSOS HUMANOS
759,FACULDADE DE CIENCIAS MEDICAS E PARAMEDICAS FL
760,FACULDADE DE CIENCIAS HUMANAS DE PERNAMBUCO
761,FACULDADE NACIONAL DE CURITIBA
762,FACULDADES INTEGRADAS DE FATIMA DO SUL
